{
  "slug": "open-vidiq",
  "name": "Open-VidIQ",
  "status": "consolidate",
  "category": "youtube-growth",
  "repoUrl": "https://github.com/SamurAIGPT/Open-VidIQ",
  "license": "MIT",
  "openSourceStatus": "open-source",
  "maintainer": "SamurAIGPT",
  "paidAlternatives": [
    "1of10",
    "Wholana",
    "Vernigo",
    "ThumblifyAI",
    "TranscriptAPI"
  ],
  "sourceDirectory": {
    "name": "Can I Vibecode It?",
    "url": "https://canivibecodeit.com",
    "slugs": [
      "1of10",
      "wholana",
      "vernigo",
      "thumblifyai",
      "transcriptapi"
    ]
  },
  "muapiFit": "high",
  "muapiMode": "required",
  "muapiCapabilities": [
    "YouTube analytics",
    "YouTube video information",
    "YouTube subtitles and comments",
    "SEO and AI-visibility analysis",
    "title, thumbnail, and script generation"
  ],
  "muapiDocsUrl": "https://muapi.ai/docs",
  "honestScope": "A starting point for a creator research and optimization dashboard that can rank videos against a channel's own baseline.",
  "gaps": [
    "Needs a complete channel dashboard and persistent history",
    "Outlier scoring and watchlist orchestration are application-side",
    "Does not contain a continuously refreshed multi-million-video corpus"
  ],
  "externalDependencies": [
    "Muapi API key",
    "YouTube OAuth",
    "YouTube API quota",
    "Production database for snapshots"
  ],
  "vibeCodedEvidence": "unverified",
  "vibeCodedEvidenceUrl": "https://github.com/SamurAIGPT/Open-VidIQ",
  "lastVerified": "2026-09-17",
  "notes": "Seed project for the planned Open YouTube Growth Radar; do not claim full VidIQ or TubeBuddy parity."
}
