{
  "slug": "social-post",
  "name": "social-post",
  "status": "existing",
  "category": "social-content",
  "repoUrl": "https://github.com/SamurAIGPT/social-post",
  "license": "No license file found",
  "openSourceStatus": "license-needed",
  "maintainer": "SamurAIGPT",
  "paidAlternatives": [
    "Buffer",
    "Postiz",
    "FeedHive",
    "Flick",
    "Typefully",
    "Predis.ai"
  ],
  "sourceDirectory": {
    "name": "Can I Vibecode It?",
    "url": "https://canivibecodeit.com",
    "slugs": [
      "buffer",
      "postiz",
      "feedhive",
      "flick",
      "typefully",
      "predis-ai"
    ]
  },
  "muapiFit": "medium",
  "muapiMode": "required",
  "muapiCapabilities": [
    "social copy generation",
    "image and video asset generation",
    "platform-specific content variants",
    "async generation and polling"
  ],
  "muapiDocsUrl": "https://muapi.ai/docs",
  "honestScope": "A social-content generation and publishing workflow that should be consolidated with the existing scheduler before expanding scope.",
  "gaps": [
    "A repository license must be added before describing this project as open-source",
    "Official platform OAuth, queues, analytics, and policy compliance remain necessary",
    "Does not reproduce a multi-network social inbox"
  ],
  "externalDependencies": [
    "Muapi API key",
    "Official platform OAuth",
    "Platform API quotas",
    "Production job queue"
  ],
  "vibeCodedEvidence": "unverified",
  "vibeCodedEvidenceUrl": "https://github.com/SamurAIGPT/social-post",
  "lastVerified": "2026-09-17",
  "notes": "License status intentionally flagged from the GitHub repository metadata."
}
