{
  "slug": "ai-clipping-generator",
  "name": "AI Clipping Generator",
  "status": "existing",
  "category": "video-repurposing",
  "repoUrl": "https://github.com/SamurAIGPT/ai-clipping-generator",
  "license": "MIT",
  "openSourceStatus": "open-source",
  "maintainer": "SamurAIGPT",
  "paidAlternatives": [
    "OpusClip",
    "Revid AI",
    "Descript",
    "Pictory",
    "InVideo",
    "VEED"
  ],
  "sourceDirectory": {
    "name": "Can I Vibecode It?",
    "url": "https://canivibecodeit.com",
    "slugs": [
      "opusclip",
      "revid",
      "descript",
      "pictory",
      "invideo",
      "veed"
    ]
  },
  "muapiFit": "high",
  "muapiMode": "required",
  "muapiCapabilities": [
    "video download",
    "video analysis",
    "short-form script generation",
    "media generation",
    "async webhooks"
  ],
  "muapiDocsUrl": "https://muapi.ai/docs",
  "honestScope": "A focused workflow for turning long-form or supplied media into short-form clips with AI-assisted selection and generation.",
  "gaps": [
    "Does not reproduce a mature transcript-based nonlinear editor",
    "Media hosting, rendering queues, and platform distribution need ongoing operations",
    "Clip quality depends on source media and model configuration"
  ],
  "externalDependencies": [
    "Muapi API key",
    "ffmpeg",
    "Object storage",
    "Optional official publishing integrations"
  ],
  "vibeCodedEvidence": "unverified",
  "vibeCodedEvidenceUrl": "https://github.com/SamurAIGPT/ai-clipping-generator",
  "lastVerified": "2026-09-17"
}
